[
  {
    "id": "QA-001",
    "area": "combat",
    "scenario": "Empty battlefield with no deploy",
    "acceptance": "No NaN, stuck engagement slot, or spontaneous damage",
    "method": "automated_and_device",
    "status": "NOT_RUN",
    "evidence": null,
    "inherited_gate": "G4",
    "phase": "PH03",
    "provenance": "v0.2 inherited"
  },
  {
    "id": "QA-002",
    "area": "combat",
    "scenario": "Same seed/input on repeated runs",
    "acceptance": "Same combat outcome and currency ledger",
    "method": "automated_and_device",
    "status": "NOT_RUN",
    "evidence": null,
    "inherited_gate": "G4",
    "phase": "PH03",
    "provenance": "v0.2 inherited"
  },
  {
    "id": "QA-003",
    "area": "combat",
    "scenario": "Insufficient Supply tap",
    "acceptance": "No spend, spawn, or queued purchase",
    "method": "automated_and_device",
    "status": "NOT_RUN",
    "evidence": null,
    "inherited_gate": "G4",
    "phase": "PH03",
    "provenance": "v0.2 inherited"
  },
  {
    "id": "QA-004",
    "area": "combat",
    "scenario": "24 alive cap and rapid multi-touch",
    "acceptance": "No overspend or excess actor; reason shown",
    "method": "automated_and_device",
    "status": "NOT_RUN",
    "evidence": null,
    "inherited_gate": "G4",
    "phase": "PH03",
    "provenance": "v0.2 inherited"
  },
  {
    "id": "QA-005",
    "area": "combat",
    "scenario": "Only ranged troops on both teams",
    "acceptance": "They become reachable frontline targets; no invulnerability",
    "method": "automated_and_device",
    "status": "NOT_RUN",
    "evidence": null,
    "inherited_gate": "G4",
    "phase": "PH03",
    "provenance": "v0.2 inherited"
  },
  {
    "id": "QA-006",
    "area": "combat",
    "scenario": "Melee reinforcement catches own ranged line",
    "acceptance": "Advances through friendlies without crossing enemies",
    "method": "automated_and_device",
    "status": "NOT_RUN",
    "evidence": null,
    "inherited_gate": "G4",
    "phase": "PH03",
    "provenance": "v0.2 inherited"
  },
  {
    "id": "QA-007",
    "area": "combat",
    "scenario": "Three melee slots and waiting reserves",
    "acceptance": "Slot turnover stable; nobody teleports into range",
    "method": "automated_and_device",
    "status": "NOT_RUN",
    "evidence": null,
    "inherited_gate": "G4",
    "phase": "PH03",
    "provenance": "v0.2 inherited"
  },
  {
    "id": "QA-008",
    "area": "combat",
    "scenario": "Equal-distance targets and repeated spawns",
    "acceptance": "Stable target ID ordering",
    "method": "automated_and_device",
    "status": "NOT_RUN",
    "evidence": null,
    "inherited_gate": "G4",
    "phase": "PH03",
    "provenance": "v0.2 inherited"
  },
  {
    "id": "QA-009",
    "area": "combat",
    "scenario": "Target dies during melee windup",
    "acceptance": "Misses without retargeting or duplicate damage",
    "method": "automated_and_device",
    "status": "NOT_RUN",
    "evidence": null,
    "inherited_gate": "G4",
    "phase": "PH03",
    "provenance": "v0.2 inherited"
  },
  {
    "id": "QA-010",
    "area": "combat",
    "scenario": "Shooter dies after bolt release",
    "acceptance": "Already released projectile remains authoritative",
    "method": "automated_and_device",
    "status": "NOT_RUN",
    "evidence": null,
    "inherited_gate": "G4",
    "phase": "PH03",
    "provenance": "v0.2 inherited"
  },
  {
    "id": "QA-011",
    "area": "combat",
    "scenario": "Grenade target moves/dies",
    "acceptance": "Explosion remains at committed ground point",
    "method": "automated_and_device",
    "status": "NOT_RUN",
    "evidence": null,
    "inherited_gate": "G4",
    "phase": "PH03",
    "provenance": "v0.2 inherited"
  },
  {
    "id": "QA-012",
    "area": "combat",
    "scenario": "Splash overlaps defending base",
    "acceptance": "No forbidden incidental base damage",
    "method": "automated_and_device",
    "status": "NOT_RUN",
    "evidence": null,
    "inherited_gate": "G4",
    "phase": "PH03",
    "provenance": "v0.2 inherited"
  },
  {
    "id": "QA-013",
    "area": "combat",
    "scenario": "Simultaneous actor deaths",
    "acceptance": "Due same-tick impacts both resolve",
    "method": "automated_and_device",
    "status": "NOT_RUN",
    "evidence": null,
    "inherited_gate": "G4",
    "phase": "PH03",
    "provenance": "v0.2 inherited"
  },
  {
    "id": "QA-014",
    "area": "combat",
    "scenario": "Both bases destroyed in same tick",
    "acceptance": "DRAW; no current battle-win reward",
    "method": "automated_and_device",
    "status": "NOT_RUN",
    "evidence": null,
    "inherited_gate": "G4",
    "phase": "PH03",
    "provenance": "v0.2 inherited"
  },
  {
    "id": "QA-015",
    "area": "combat",
    "scenario": "150s and 210s boundaries",
    "acceptance": "Overtime and integer fraction outcome exactly once",
    "method": "automated_and_device",
    "status": "NOT_RUN",
    "evidence": null,
    "inherited_gate": "G4",
    "phase": "PH03",
    "provenance": "v0.2 inherited"
  },
  {
    "id": "QA-016",
    "area": "combat",
    "scenario": "Pause/background/SDK overlay",
    "acceptance": "No Supply, cooldown, movement, or enemy time advance",
    "method": "automated_and_device",
    "status": "NOT_RUN",
    "evidence": null,
    "inherited_gate": "G4",
    "phase": "PH03",
    "provenance": "v0.2 inherited"
  },
  {
    "id": "QA-017",
    "area": "combat",
    "scenario": "Rally during existing attack and new spawn",
    "acceptance": "Existing attack snapshot retained; new attacks use buff",
    "method": "automated_and_device",
    "status": "NOT_RUN",
    "evidence": null,
    "inherited_gate": "G4",
    "phase": "PH03",
    "provenance": "v0.2 inherited"
  },
  {
    "id": "QA-018",
    "area": "combat",
    "scenario": "Float-equivalent rounding edges",
    "acceptance": "Half-up damage, ceiling costs, minimum damage shared with UI",
    "method": "automated_and_device",
    "status": "NOT_RUN",
    "evidence": null,
    "inherited_gate": "G4",
    "phase": "PH03",
    "provenance": "v0.2 inherited"
  },
  {
    "id": "QA-019",
    "area": "combat",
    "scenario": "Projectile VFX pool exhausted",
    "acceptance": "No lost gameplay damage or duplicate award",
    "method": "automated_and_device",
    "status": "NOT_RUN",
    "evidence": null,
    "inherited_gate": "G4",
    "phase": "PH03",
    "provenance": "v0.2 inherited"
  },
  {
    "id": "QA-020",
    "area": "combat",
    "scenario": "Enemy queued troop cannot afford cost",
    "acceptance": "Waits without skipping queue or inventing Supply",
    "method": "automated_and_device",
    "status": "NOT_RUN",
    "evidence": null,
    "inherited_gate": "G4",
    "phase": "PH03",
    "provenance": "v0.2 inherited"
  },
  {
    "id": "QA-021",
    "area": "draft",
    "scenario": "Initial three offers",
    "acceptance": "One eligible behavior option; all options usable",
    "method": "automated_and_device",
    "status": "NOT_RUN",
    "evidence": null,
    "inherited_gate": "G5",
    "phase": "PH03",
    "provenance": "v0.2 inherited"
  },
  {
    "id": "QA-022",
    "area": "draft",
    "scenario": "All 15 loadouts and seeded offer sequences",
    "acceptance": "No ineligible troop upgrades; no chosen duplicate",
    "method": "automated_and_device",
    "status": "NOT_RUN",
    "evidence": null,
    "inherited_gate": "G5",
    "phase": "PH03",
    "provenance": "v0.2 inherited"
  },
  {
    "id": "QA-023",
    "area": "draft",
    "scenario": "Free and rewarded reroll exhaustion",
    "acceptance": "Exactly one each; no further charge or ad offer",
    "method": "automated_and_device",
    "status": "NOT_RUN",
    "evidence": null,
    "inherited_gate": "G5",
    "phase": "PH03",
    "provenance": "v0.2 inherited"
  },
  {
    "id": "QA-024",
    "area": "draft",
    "scenario": "Force close on choice/reroll",
    "acceptance": "Persisted offers and counts; no free reroll from restart",
    "method": "automated_and_device",
    "status": "NOT_RUN",
    "evidence": null,
    "inherited_gate": "G5",
    "phase": "PH03",
    "provenance": "v0.2 inherited"
  },
  {
    "id": "QA-025",
    "area": "draft",
    "scenario": "Conscription at full actor cap",
    "acceptance": "At most one owed bonus; no recursive deployment",
    "method": "automated_and_device",
    "status": "NOT_RUN",
    "evidence": null,
    "inherited_gate": "G5",
    "phase": "PH03",
    "provenance": "v0.2 inherited"
  },
  {
    "id": "QA-026",
    "area": "draft",
    "scenario": "Pierce and sweeping secondary hits",
    "acceptance": "Target limits/damage factors; no recursive or forbidden base proc",
    "method": "automated_and_device",
    "status": "NOT_RUN",
    "evidence": null,
    "inherited_gate": "G5",
    "phase": "PH03",
    "provenance": "v0.2 inherited"
  },
  {
    "id": "QA-027",
    "area": "draft",
    "scenario": "Every upgrade plus every pair",
    "acceptance": "Modifier composition, caps, and UI descriptions agree",
    "method": "automated_and_device",
    "status": "NOT_RUN",
    "evidence": null,
    "inherited_gate": "G5",
    "phase": "PH03",
    "provenance": "v0.2 inherited"
  },
  {
    "id": "QA-028",
    "area": "draft",
    "scenario": "Third ram base hit",
    "acceptance": "Only landed base hits increment; bonus never recursively retriggers",
    "method": "automated_and_device",
    "status": "NOT_RUN",
    "evidence": null,
    "inherited_gate": "G5",
    "phase": "PH03",
    "provenance": "v0.2 inherited"
  },
  {
    "id": "QA-029",
    "area": "draft",
    "scenario": "Barrier expires or takes excess damage",
    "acceptance": "Correct armor/barrier/HP order and remaining damage",
    "method": "automated_and_device",
    "status": "NOT_RUN",
    "evidence": null,
    "inherited_gate": "G5",
    "phase": "PH03",
    "provenance": "v0.2 inherited"
  },
  {
    "id": "QA-030",
    "area": "save",
    "scenario": "Win reward callback repeats",